{
  "schema_version": "2.0.0",
  "content_version": "0.1.3",
  "graph_id": "singapore_lower_secondary_science",
  "subject": "Science",
  "jurisdictions": [
    "SG"
  ],
  "source_ids": [
    "src_sg_moe_lower_secondary_g2_g3_science_2021",
    "src_openstax_chemistry_2e_2019",
    "src_openstax_college_physics_2e_2022",
    "src_openstax_biology_2e_2018",
    "src_openstax_university_physics_v2_2016",
    "src_openstax_microbiology_2016"
  ],
  "review_status": "approved",
  "changelog": [
    {
      "version": "0.1.0",
      "date": "2026-07-19",
      "summary_zh": "根据 MOE 159 条学习成果审查建立 32 个最小可诊断概念；每个概念同时登记官方课程与开放学科教材证据。"
    },
    {
      "version": "0.1.1",
      "date": "2026-08-27",
      "summary_zh": "依据官方课程成果顺序补充 4 条同图前置边（含 0 条硬前置），状态保持 needs_review。"
    },
    {
      "version": "0.1.2",
      "date": "2026-10-25",
      "summary_zh": "按 2026-10-25 官方来源复核更新证据定位（中国课标迁至 2025 日常修订版、新加坡页码校正），状态保持 needs_review。"
    },
    {
      "version": "0.1.3",
      "date": "2026-10-25",
      "summary_zh": "完成联网核验与人工批准：删除 3 条不成立的先修边，新增 0 条，调整 0 条强度，改写 1 条先修理由。"
    }
  ],
  "nodes": [
    {
      "id": "sg_lss_science_topic_matter_properties_composition",
      "kind": "topic",
      "name": "Matter properties and composition",
      "name_zh": "物质性质与组成",
      "topic": null,
      "default_order": 1,
      "evidence_refs": [
        {
          "source_id": "src_sg_moe_lower_secondary_g2_g3_science_2021",
          "locator": "PDF p.33, topic 2 learning outcomes"
        },
        {
          "source_id": "src_openstax_chemistry_2e_2019",
          "locator": "OpenStax Chemistry 2e §§1.3-1.4, Physical and Chemical Properties; Measurements"
        },
        {
          "source_id": "src_sg_moe_lower_secondary_g2_g3_science_2021",
          "locator": "PDF p.34, topic 3 learning outcomes"
        },
        {
          "source_id": "src_openstax_chemistry_2e_2019",
          "locator": "OpenStax Chemistry 2e §1.2, Phases and Classification of Matter; §2.5, The Periodic Table"
        },
        {
          "source_id": "src_openstax_chemistry_2e_2019",
          "locator": "OpenStax Chemistry 2e §1.2, Phases and Classification of Matter; §§11.1-11.3, Solutions and Solubility"
        }
      ],
      "review_status": "approved"
    },
    {
      "id": "sg_lss_science_topic_mixture_separation",
      "kind": "topic",
      "name": "Mixture separation",
      "name_zh": "混合物分离",
      "topic": null,
      "default_order": 2,
      "evidence_refs": [
        {
          "source_id": "src_sg_moe_lower_secondary_g2_g3_science_2021",
          "locator": "PDF p.35, topic 4 learning outcomes"
        },
        {
          "source_id": "src_openstax_chemistry_2e_2019",
          "locator": "OpenStax Chemistry 2e §1.2, physical separation of mixtures"
        },
        {
          "source_id": "src_openstax_chemistry_2e_2019",
          "locator": "OpenStax Chemistry 2e §1.2, mixture classification and physical separation; Chapter 11, Solutions and Colloids"
        }
      ],
      "review_status": "approved"
    },
    {
      "id": "sg_lss_science_topic_light_ray_model",
      "kind": "topic",
      "name": "Ray model of light",
      "name_zh": "光的射线模型",
      "topic": null,
      "default_order": 3,
      "evidence_refs": [
        {
          "source_id": "src_sg_moe_lower_secondary_g2_g3_science_2021",
          "locator": "PDF p.37, topic 5 learning outcomes"
        },
        {
          "source_id": "src_openstax_college_physics_2e_2022",
          "locator": "OpenStax College Physics 2e §§25.1-25.2, The Ray Aspect of Light; The Law of Reflection"
        },
        {
          "source_id": "src_openstax_college_physics_2e_2022",
          "locator": "OpenStax College Physics 2e §§25.3 and 25.5, The Law of Refraction; Dispersion"
        }
      ],
      "review_status": "approved"
    },
    {
      "id": "sg_lss_science_topic_cell_model",
      "kind": "topic",
      "name": "Cell models and organisation",
      "name_zh": "细胞模型与结构层级",
      "topic": null,
      "default_order": 4,
      "evidence_refs": [
        {
          "source_id": "src_sg_moe_lower_secondary_g2_g3_science_2021",
          "locator": "PDF p.38, topic 6 learning outcomes"
        },
        {
          "source_id": "src_openstax_biology_2e_2018",
          "locator": "OpenStax Biology 2e §§4.1-4.3, Studying Cells; Eukaryotic Cells"
        },
        {
          "source_id": "src_openstax_biology_2e_2018",
          "locator": "OpenStax Biology 2e §4.1, Studying Cells, cells to tissues, organs and organ systems"
        }
      ],
      "review_status": "approved"
    },
    {
      "id": "sg_lss_science_topic_particle_matter",
      "kind": "topic",
      "name": "Particle model of matter",
      "name_zh": "物质粒子模型",
      "topic": null,
      "default_order": 5,
      "evidence_refs": [
        {
          "source_id": "src_sg_moe_lower_secondary_g2_g3_science_2021",
          "locator": "PDF p.39, topic 7 learning outcomes"
        },
        {
          "source_id": "src_openstax_chemistry_2e_2019",
          "locator": "OpenStax Chemistry 2e §1.2, phases of matter; §§10.1-10.3, intermolecular forces and phase transitions"
        },
        {
          "source_id": "src_openstax_chemistry_2e_2019",
          "locator": "OpenStax Chemistry 2e §1.2, phases and conservation of matter; §10.3, Phase Transitions"
        }
      ],
      "review_status": "approved"
    },
    {
      "id": "sg_lss_science_topic_atoms_molecules",
      "kind": "topic",
      "name": "Atoms and molecules",
      "name_zh": "原子与分子",
      "topic": null,
      "default_order": 6,
      "evidence_refs": [
        {
          "source_id": "src_sg_moe_lower_secondary_g2_g3_science_2021",
          "locator": "PDF p.40, topic 8 learning outcomes"
        },
        {
          "source_id": "src_openstax_chemistry_2e_2019",
          "locator": "OpenStax Chemistry 2e §§2.2-2.3, Evolution of Atomic Theory; Atomic Structure and Symbolism"
        },
        {
          "source_id": "src_openstax_chemistry_2e_2019",
          "locator": "OpenStax Chemistry 2e §1.2, Atoms and Molecules; §2.4, Chemical Formulas"
        }
      ],
      "review_status": "approved"
    },
    {
      "id": "sg_lss_science_topic_forces_pressure",
      "kind": "topic",
      "name": "Forces, energy transfer and pressure",
      "name_zh": "力、能量转移与压强",
      "topic": null,
      "default_order": 7,
      "evidence_refs": [
        {
          "source_id": "src_sg_moe_lower_secondary_g2_g3_science_2021",
          "locator": "PDF p.42, topic 9 learning outcomes"
        },
        {
          "source_id": "src_openstax_college_physics_2e_2022",
          "locator": "OpenStax College Physics 2e Chapter 4, Dynamics; Chapter 7, Work, Energy, and Energy Resources"
        },
        {
          "source_id": "src_openstax_college_physics_2e_2022",
          "locator": "OpenStax College Physics 2e Chapter 11, Fluid Statics, pressure and pressure variation with depth"
        }
      ],
      "review_status": "approved"
    },
    {
      "id": "sg_lss_science_topic_thermal_transfer",
      "kind": "topic",
      "name": "Thermal transfer and expansion",
      "name_zh": "热传递与热膨胀",
      "topic": null,
      "default_order": 8,
      "evidence_refs": [
        {
          "source_id": "src_sg_moe_lower_secondary_g2_g3_science_2021",
          "locator": "PDF p.44, topic 10 learning outcomes"
        },
        {
          "source_id": "src_openstax_university_physics_v2_2016",
          "locator": "OpenStax University Physics Volume 2 §1.3, Thermal Expansion"
        },
        {
          "source_id": "src_openstax_university_physics_v2_2016",
          "locator": "OpenStax University Physics Volume 2 §1.6, Mechanisms of Heat Transfer"
        },
        {
          "source_id": "src_openstax_university_physics_v2_2016",
          "locator": "OpenStax University Physics Volume 2 §1.6, radiation and net radiative heat transfer"
        }
      ],
      "review_status": "approved"
    },
    {
      "id": "sg_lss_science_topic_chemical_change",
      "kind": "topic",
      "name": "Chemical change",
      "name_zh": "化学变化",
      "topic": null,
      "default_order": 9,
      "evidence_refs": [
        {
          "source_id": "src_sg_moe_lower_secondary_g2_g3_science_2021",
          "locator": "PDF p.45, topic 11 learning outcomes"
        },
        {
          "source_id": "src_openstax_chemistry_2e_2019",
          "locator": "OpenStax Chemistry 2e §1.2, conservation of matter; §4.1, Writing and Balancing Chemical Equations"
        },
        {
          "source_id": "src_openstax_chemistry_2e_2019",
          "locator": "OpenStax Chemistry 2e §§4.1-4.2, Writing and Classifying Chemical Reactions"
        }
      ],
      "review_status": "approved"
    },
    {
      "id": "sg_lss_science_topic_ecosystem_interactions",
      "kind": "topic",
      "name": "Ecosystem interactions and cycling",
      "name_zh": "生态相互作用与物质循环",
      "topic": null,
      "default_order": 10,
      "evidence_refs": [
        {
          "source_id": "src_sg_moe_lower_secondary_g2_g3_science_2021",
          "locator": "PDF p.46, topic 12 learning outcomes"
        },
        {
          "source_id": "src_openstax_biology_2e_2018",
          "locator": "OpenStax Biology 2e §45.6, Community Ecology; §46.1, Ecology of Ecosystems"
        },
        {
          "source_id": "src_openstax_biology_2e_2018",
          "locator": "OpenStax Biology 2e §§46.1 and 46.3, Ecosystems; Biogeochemical Cycles"
        }
      ],
      "review_status": "approved"
    },
    {
      "id": "sg_lss_science_topic_current_effects",
      "kind": "topic",
      "name": "Effects of electric current",
      "name_zh": "电流的效应",
      "topic": null,
      "default_order": 11,
      "evidence_refs": [
        {
          "source_id": "src_sg_moe_lower_secondary_g2_g3_science_2021",